export interface BlogPostMetadata {
  id: string;
  blogNumber: number;
  title: string;
  excerpt: string;
  date: string;
  dateSort: Date;
  readTime: string;
  seoDescription?: string;
}

export const blogPosts: BlogPostMetadata[] = [
  {
    id: 'rebellious-guide-what-is-on-your-plate',
    title: 'The Rebellious Guide (What is on Your Plate)',
    excerpt: 'Let\'s set the table for something deliciously different. I am excited to talk with you about something that has transformed my life - the Whole Food Plant Based (WFPB) lifestyle.',
    date: '1/15/2025',
    dateSort: new Date('2025-01-15'),
    readTime: '8 min read',
    blogNumber: 1
  },
  {
    id: 'the-road-to-success-8-thoughts',
    title: 'The Road to Success: 8 Thoughts',
    excerpt: 'Eight powerful principles that pave the way to success: from hard work and patience to self-confidence and focus. Discover the mindset shifts that transform ordinary into extraordinary.',
    date: '2/1/2025',
    dateSort: new Date('2025-02-01'),
    readTime: '3 min read',
    blogNumber: 2
  },
  {
    id: 'wfpb-lifestyle-guide',
    title: 'A Quick Introduction and Guide to a Whole-Food Plant-Based (WFPB) Lifestyle',
    excerpt: 'The WFPB lifestyle is NOT a diet. It is a lifestyle which promotes better health, greater energy, and a deeper connection with the way humans chose to nourish themselves.',
    date: '2/15/2025',
    dateSort: new Date('2025-02-15'),
    readTime: '12 min read',
    blogNumber: 3
  },
  {
    id: 'a-love-letter-to-my-closet',
    title: 'A Love Letter to My Closet',
    excerpt: 'There was a time I dressed to impress. Now? I dress to express. My closet is no longer a holding pen for solid black.',
    date: '3/1/2025',
    dateSort: new Date('2025-03-01'),
    readTime: '10 min read',
    blogNumber: 4
  },
  {
    id: 'blueberries-and-wrinkles',
    title: 'Blueberries and Wrinkles, The Day I Knew I was Old.',
    excerpt: 'One bowl of wild blueberries, a casual walk out the door, and a bold little truth tucked into the confident grooves around my mouth—that was the day I knew I had crossed into "old" and the moment my rebellion revved up.',
    date: '3/15/2025',
    dateSort: new Date('2025-03-15'),
    readTime: '6 min read',
    blogNumber: 5
  },
  {
    id: 'gratitude-rebellious-soul',
    title: 'Gratitude and the Rebellious Soul',
    excerpt: 'Exploring the transformative power of gratitude in our journey toward rebellious aging. Discover how appreciation and thankfulness can reshape our perspective on life, aging, and personal growth.',
    date: '4/1/2025',
    dateSort: new Date('2025-04-01'),
    readTime: '15 min read',
    blogNumber: 6
  },
  {
    id: 'art-of-thriving-aging-expert',
    title: 'The Art of Thriving. What an Ageing Expert Wants You to Know',
    excerpt: 'Inspired by Dr. Kerry Burnight\'s wisdom on aging, this blog explores the concept of "joyspan" - living with connection, purpose, and soul-deep contentment that makes aging feel like a privilege.',
    date: '4/15/2025',
    dateSort: new Date('2025-04-15'),
    readTime: '12 min read',
    blogNumber: 7
  },
  {
    id: 'shop-window-aging-gracefully',
    title: 'What a Shop Window Taught Me About Aging Gracefully',
    excerpt: 'Who knew a shop window could deliver a life lesson? One early morning glance stopped me in my tracks and got me thinking about posture, presence, and how we carry ourselves through the years.',
    date: '5/1/2025',
    dateSort: new Date('2025-05-01'),
    readTime: '10 min read',
    blogNumber: 8
  },
  {
    id: 'set-record-straight-wfpb',
    title: 'It\'s Time to Set the Record Straight Regarding a Whole Food Plant Based Lifestyle',
    excerpt: 'Let\'s be honest. When you mention to other humans that you are eating mostly plants, the reactions range from curious to downright skeptical. Time to clear the air and debunk the myths.',
    date: '8/4/2025',
    dateSort: new Date('2025-08-04'),
    readTime: '8 min read',
    blogNumber: 9
  },
  {
    id: 'limiting-beliefs-not-boss',
    title: 'Shhh…That Voice in Your Head is Not the Boss of You',
    excerpt: 'Let\'s get one thing straight. Those whispers in your head saying you are too old, too late, not stylish enough, they are NOT the truth. They are old scripts, hand-me-down fears, and quite frankly, they are BORING!',
    date: '8/6/2025',
    dateSort: new Date('2025-08-06'),
    readTime: '9 min read',
    blogNumber: 10
  },
  {
    id: 'what-is-behind-limiting-beliefs',
    title: 'What is Behind Limiting Beliefs?',
    excerpt: 'The voices that taunt us, saying things like you are too old, or you are not enough, or you\'ll fail, are not a mystical curse. Here\'s the science behind it.',
    date: '8/7/2025',
    dateSort: new Date('2025-08-07'),
    readTime: '7 min read',
    blogNumber: 11
  },
  {
    id: 'wearing-who-you-are-style-rebellion',
    title: 'Wearing Who You Are, A Style Rebellion',
    excerpt: 'When it comes to aging and fashion, society hands us a beige cardigan and whispers "please, just fade away." Well thanks, but no thank you. Here at Rebellious Aging, we don\'t tone it down. WE TURN IT UP.',
    date: '8/7/2025',
    dateSort: new Date('2025-08-07'),
    readTime: '9 min read',
    blogNumber: 12
  },
  {
    id: 'the-new-classic-timeless-style',
    title: 'The New Classic, Timeless Style with a Rebellious Twist',
    excerpt: 'Fashion legends like Coco Chanel, Christian Dior, and Yves Saint Laurent gave the world timeless rules for elegance. As rebels we just give these rules a wink and twist them into something uniquely ours.',
    date: '8/9/2025',
    dateSort: new Date('2025-08-09'),
    readTime: '12 min read',
    blogNumber: 14
  },
  {
    id: 'bold-sassy-truth-wfpb',
    title: 'The Bold, Sassy Truth About a Whole Food Plant Based Lifestyle',
    excerpt: 'Who says aging gracefully has to be slow and quiet? Not me. I believe in aging rebelliously. With a plate full of vibrant colors, flavors, and life giving nutrients. A WFPB lifestyle isn\'t just about "rabbit food."',
    date: '8/9/2025',
    dateSort: new Date('2025-08-09'),
    readTime: '10 min read',
    blogNumber: 13
  },
  {
    id: 'wfpb-lifestyle-book-recommendations',
    title: 'WFPB Lifestyle Book Recommendations',
    excerpt: 'A comprehensive collection of essential books from leading plant-based nutrition experts and doctors to guide your whole food plant-based journey.',
    date: '8/15/2025',
    dateSort: new Date('2025-08-15'),
    readTime: '15 min read',
    blogNumber: 15
  },
  {
    id: 'boundaries-love-language',
    title: 'Are Boundaries a Love Language of Sorts?',
    excerpt: 'The Summer of 2025 has been one long crash course in awkward situations. Some mine, some borrowed from others, but all pointing to one glaring truth, I NEED BOUNDARIES.',
    date: '8/29/2025',
    dateSort: new Date('2025-08-29'),
    readTime: '12 min read',
    blogNumber: 16
  },
  {
    id: 'ditch-the-sweet-stuff',
    title: 'Ditch the Sweet Stuff',
    excerpt: 'Let\'s be honest, sugar is seductive. There is no upside to sugar. It sneaks into your morning coffee, whispers from your cookie jar, and struts through the grocery store in shiny packaging.',
    date: '9/1/2025',
    dateSort: new Date('2025-09-01'),
    readTime: '10 min read',
    blogNumber: 17
  },
  {
    id: 'eat-the-olive-not-the-oil',
    title: 'Eat the Olive, Not the Oil',
    excerpt: 'Oil has a shiny reputation. Olive oil, avocado oil, coconut oil—sure, they are marketed as “healthy fats,” but the truth is oil is oil and even the “best” versions are still calorie-dense, nutrient-poor processed foods.',
    date: '9/2/2025',
    dateSort: new Date('2025-09-02'),
    readTime: '11 min read',
    blogNumber: 18
  },
  {
    id: 'less-salt-more-sparkle',
    title: 'Less Salt, More Sparkle',
    excerpt: 'Let\'s be honest: salt has been riding high on its reputation as the magic dust that makes food taste better. Very fancy marketing, but let\'s cut through the hype, Salt is Salt.',
    date: '9/2/2025',
    dateSort: new Date('2025-09-02'),
    readTime: '12 min read',
    blogNumber: 19
  },
  {
    id: 'critical-thinking-secret-weapon-rebellious-aging',
    title: 'Critical Thinking: Your Secret Weapon for Rebellious Aging',
    excerpt: 'Critical Thinking is the rebel\'s power move. It is the ability to pause, question, and separate truth from noise. So instead of blindly accepting what you are told, ask: What\'s the evidence? Who benefits if I believe this? That is where the freedom and sparkle live.',
    date: '9/2/2025',
    dateSort: new Date('2025-09-02'),
    readTime: '10 min read',
    blogNumber: 20
  },
  {
    id: 'ultra-processed-trap-eat-whole-live-whole',
    title: 'The Ultra-Processed Trap: Eat Whole, Live Whole',
    excerpt: 'Did you know that more than HALF of the average American diet comes from ultra-processed food? 70-73% of the U.S. food supply is classified as ultra-processed. Discover why choosing whole foods over factory formulations is your path to vibrant health.',
    date: '9/15/2025',
    dateSort: new Date('2025-09-15'),
    readTime: '12 min read',
    blogNumber: 21
  },
  {
    id: 'if-not-now-when-new-beginnings',
    title: 'If Not Now, When? New Beginnings are up to YOU',
    excerpt: 'Have you ever scrolled through your feed when a phrase suddenly grabs you by the collar? "If not now, when?" stopped me cold. How many women are quietly living on autopilot? Rebellious Aging is about refusing to settle for bland.',
    date: '9/6/2025',
    dateSort: new Date('2025-09-06'),
    readTime: '8 min read',
    blogNumber: 22
  },
  {
    id: 'optimal-aging-colleen-murphy',
    title: 'Optimal Aging: As Seen Through the Lens of Princeton Professor Colleen Murphy',
    excerpt: 'A conversation between journalist Paul Von Zielbauer and Princeton Professor Colleen Murphy distilled the science of aging into practical, myth-busting tips. Exercise is NOT optional, sleep is your overnight cleaning crew, and food myths debunked.',
    date: '9/20/2025',
    dateSort: new Date('2025-09-20'),
    readTime: '10 min read',
    blogNumber: 23
  },
  {
    id: 'calorie-density-secret-seals-deal',
    title: 'Calorie Density: The Secret That Seals the Deal',
    excerpt: 'Managing weight doesn\'t have to be an uphill climb. When you choose the right foods, your body naturally regulates weight. The key is calorie density - the number of calories in a given weight of food. Plants hold the secret to eating until satisfied without overeating.',
    date: '9/10/2025',
    dateSort: new Date('2025-09-10'),
    readTime: '9 min read',
    blogNumber: 24
  },
  {
    id: 'join-rebellious-aging-facebook-group',
    title: 'Let\'s Continue the Conversation: Join The PRIVATE, Rebellious Aging Facebook Group',
    excerpt: 'Step into a private Facebook community where women 55-105 gather to share stories, support, and the courage to live vibrantly while eating powerfully, living loudly, and aging boldly.',
    date: '10/29/2025',
    dateSort: new Date('2025-10-29'),
    readTime: '5 min read',
    blogNumber: 25
  },
  {
    id: 'strength-and-balance-for-the-win',
    title: 'Strength and Balance for the Win!',
    excerpt: 'As we age, movement becomes about confidence, balance, and extending our health span; strength and steady footing keep us vibrant.',
    date: '11/15/2025',
    dateSort: new Date('2025-11-15'),
    readTime: '9 min read',
    blogNumber: 26
  },
  {
    id: 'style-still-counts-make-it-yours-at-every-age',
    title: 'Style Still Counts, Make it Yours at Every Age',
    excerpt: 'Refuse invisibility: curate a wardrobe that loves you back, shop with intention, and let personal style shine brighter with every decade.',
    date: '11/30/2025',
    dateSort: new Date('2025-11-30'),
    readTime: '8 min read',
    blogNumber: 27,
    seoDescription: 'Style has no expiration date - declutter with purpose, invest in flattering pieces, and embrace elegance that reflects your rebellious spirit.'
  },
  {
    id: 'following-the-science-and-your-common-sense',
    title: 'Following the Science (and Your Common Sense)',
    excerpt: 'Science evolves, gurus shout, and agendas creep in—here’s how Suz navigates the noise by trusting evidence, curiosity, and a WFPB lifestyle that has stood the test of decades.',
    date: '12/15/2025',
    dateSort: new Date('2025-12-15'),
    readTime: '6 min read',
    blogNumber: 28,
    seoDescription: 'Cut through nutrition confusion with curiosity, credible mentors like Dr. Campbell and Dr. Esselstyn, and your own common sense.'
  },
  {
    id: 'graceful-maybe-rebellious-definitely',
    title: 'Graceful? Maybe. Rebellious? Definitely.',
    excerpt: 'Inspired by Farley Ledgerwood’s reminder that aging isn’t fading, Suz shares six habits to drop after 60 so you can move, nourish, feel, and say yes to yourself with a rebellious glow.',
    date: '12/30/2025',
    dateSort: new Date('2025-12-30'),
    readTime: '7 min read',
    blogNumber: 29,
    seoDescription: 'Let go of optional movement, 25-year-old eating, people pleasing, comparisons, bottled emotions, and grudges so your next decades feel bold, conscious, and sparkling.'
  },
  {
    id: 'how-the-food-supply-stacks-the-deck-against-you',
    title: 'How the Food Supply Stacks the Deck Against You!',
    excerpt: 'Nutrition scientist Kevin Hall, PhD, explains why today’s ultra-processed food environment makes overeating effortless, and why compassion plus strategy—not shame—belongs at the center of the conversation.',
    date: '1/10/2026',
    dateSort: new Date('2026-01-10'),
    readTime: '6 min read',
    blogNumber: 30,
    seoDescription: 'Shift from self-blame to awareness as UPFs, engineered calories, and system-level incentives fuel weight gain—and learn small steps to reclaim agency.'
  },
  {
    id: 'losing-weight-without-losing-your-sparkle',
    title: 'Losing Weight Without Losing Your Sparkle',
    excerpt: 'Weight loss does not have to dim your joy. A Whole Food Plant Based lifestyle lets you trade restriction for color, freedom, and sparkle while the science quietly supports lasting results.',
    date: '1/25/2026',
    dateSort: new Date('2026-01-25'),
    readTime: '9 min read',
    blogNumber: 31,
    seoDescription: 'Discover how a Whole Food Plant Based lifestyle delivers natural weight loss, steady energy, and confidence without calorie counting or deprivation.'
  },
  {
    id: 'retirement-fade-or-focus',
    title: 'Retirement! Fade or Focus',
    excerpt: 'Retirement can feel exhilarating and disorienting at the same time. Let’s map the emotional landscape, prepare beyond finances, and enter this new chapter with curiosity, structure, and sparkle.',
    date: '3/10/2026',
    dateSort: new Date('2026-03-10'),
    readTime: '9 min read',
    blogNumber: 32,
    seoDescription: 'Learn how to prepare emotionally, mentally, and practically for retirement so you trade fading away for focused reinvention, connection, and purpose.'
  },
  {
    id: 'plants-do-not-disappoint',
    title: 'Plants Do NOT Disappoint',
    excerpt: 'Plants show up honest, vibrant, and nourishing—invite them onto your plate to restore energy without conditions.',
    date: '4/1/2026',
    dateSort: new Date('2026-04-01'),
    readTime: '6 min read',
    blogNumber: 33,
    seoDescription: 'Why whole, unprocessed plants never disappoint and how welcoming more of them into your kitchen sparks honest nourishment at any age.'
  },
  {
    id: 'motion-is-not-negotiable',
    title: 'Motion is Not Negotiable',
    excerpt: 'Movement is essential self-care—here’s how Suz keeps showing up with walking, strength, balance, and playful consistency.',
    date: '5/1/2026',
    dateSort: new Date('2026-05-01'),
    readTime: '8 min read',
    blogNumber: 34,
    seoDescription: 'Discover why motion stays non-negotiable for Suz and how simple, steady routines keep bodies strong, sharp, and joyful at any age.'
  },
  {
    id: 'lifestyle-medicine-six-pillars',
    title: 'Lifestyle Medicine: The Six Pillars',
    excerpt: 'Lifestyle Medicine offers six evidence-backed pillars—food, movement, sleep, stress, connection, and low-risk choices—to help you age rebelliously.',
    date: '6/1/2026',
    dateSort: new Date('2026-06-01'),
    readTime: '10 min read',
    blogNumber: 35,
    seoDescription: 'Explore the six Lifestyle Medicine pillars from ACLM and how simple daily habits power food-as-medicine, movement, rest, calm, community, and safer choices.'
  },
  {
    id: 'seven-day-balance-challenge',
    title: '7 Day Balance Challenge',
    excerpt: 'Seven bite-sized daily balance drills to boost confidence, stability, and freedom in one focused week.',
    date: '7/1/2026',
    dateSort: new Date('2026-07-01'),
    readTime: '4 min read',
    blogNumber: 37,
    seoDescription: 'Follow Suz’s 7-day balance challenge—stand, walk, shift, and steady yourself with simple daily drills for lifelong stability.'
  },
  {
    id: 'the-pleasure-trap-why-it-is-not-your-fault',
    title: 'The Pleasure Trap (Why it is NOT Your Fault)',
    excerpt: 'Discover Dr. Doug Lisle’s framework for understanding why modern food, sedentary defaults, and endless stimulation hijack biology—and how to step out of the trap.',
    date: '8/1/2026',
    dateSort: new Date('2026-08-01'),
    readTime: '7 min read',
    blogNumber: 38,
    seoDescription: 'Learn how The Pleasure Trap explains cravings, why willpower isn’t broken, and how whole foods plus gentle routines reset biology at any age.'
  },
  {
    id: 'b12-the-little-vitamin-with-a-big-job',
    title: 'B12, The Little Vitamin With A Big Job',
    excerpt: 'Why vitamin B12 is essential for energy, cognition, nerves, and emotional resilience—and how smart supplementation keeps rebels thriving past 50.',
    date: '9/1/2026',
    dateSort: new Date('2026-09-01'),
    readTime: '8 min read',
    blogNumber: 39,
    seoDescription: 'Dr. Greger’s B12 guidance explained: spot deficiency signs, choose cyanocobalamin, and test smarter so aging boldly never runs on empty.'
  },
  {
    id: 'the-secret-strength-of-rest-days',
    title: 'The Secret Strength of Rest Days, Why Pausing Makes You Powerful',
    excerpt: 'Discover how strategic rest keeps workouts joyful, hormones balanced, and bodies thriving—because pausing is power, not quitting.',
    date: '10/1/2026',
    dateSort: new Date('2026-10-01'),
    readTime: '5 min read',
    blogNumber: 40,
    seoDescription: 'Learn why women 55+ need intentional rest days to prevent injury, sharpen balance, and stay motivated in the Rebellious Aging movement.'
  },
  {
    id: 'the-15-second-shock-why-food-matters',
    title: 'The 15 Second Shock, Why Food Matters',
    excerpt: 'A jarring 15-second cancer statistic is a wake-up call to crowd out ultra-processed foods with colorful plants, movement, and intention.',
    date: '11/1/2026',
    dateSort: new Date('2026-11-01'),
    readTime: '7 min read',
    blogNumber: 41,
    seoDescription: 'Every 15 seconds a new cancer diagnosis lands - here is why food, movement, and choosing whole plants give you influence over your health span.'
  },
  {
    id: 'the-quiet-magic-of-consistency',
    title: 'The Quiet Magic of Consistency',
    excerpt: 'Consistency is the quiet hero that transforms health, confidence, and style through small daily actions after 55.',
    date: '12/1/2026',
    dateSort: new Date('2026-12-01'),
    readTime: '9 min read',
    blogNumber: 42,
    seoDescription: 'Discover how small, repeated choices around plants, movement, style, and self-compassion create rebellious results after 55.'
  },
  {
    id: 'the-weekend-epiphany-why-resting-is-the-new-rebellion',
    title: 'The Weekend Epiphany, Why Resting is the New Rebellion',
    excerpt: 'A quiet Saturday wake-up call turned weekends into sacred time for joy, softness, and honoring what truly nourishes you.',
    date: '1/1/2027',
    dateSort: new Date('2027-01-01'),
    readTime: '10 min read',
    blogNumber: 43,
    seoDescription: 'Reclaim weekends as rebellion—listen to your body, set boundaries with rest, and let joy-filled pauses fuel a vibrant life.'
  },
  {
    id: 'thanksgiving-recipes-plantstrong-favorites',
    title: 'Thanksgiving Recipes',
    excerpt: 'Suz shares her plantstrong Thanksgiving lineup—garlicky mashed potatoes, mushroom gravy, sweet potato casserole, super salad, pumpkin pie tart, stuffing, and cornbread.',
    date: '2/1/2027',
    dateSort: new Date('2027-02-01'),
    readTime: '14 min read',
    blogNumber: 44,
    seoDescription: 'Plantstrong Thanksgiving favorites with Ann Esselstyn’s mashed potatoes and gravy, sweet potato casserole, super salad, pumpkin pie tart, stuffing, and corn muffins.'
  },
  {
    id: 'when-joy-and-sorrow-share-a-seat-at-the-table',
    title: 'When Joy and Sorrow Share a Seat at the Table',
    excerpt: 'Holidays can hold belly laughs and tears at once—let joy and grief sit together so love keeps flowing.',
    date: '3/1/2027',
    dateSort: new Date('2027-03-01'),
    readTime: '7 min read',
    blogNumber: 45,
    seoDescription: 'Suz reflects on holidays after loss, how tears are love in motion, and why joy and sorrow can share space without canceling each other out.'
  },
  {
    id: 'passing-the-baton-thanksgiving-reflection',
    title: 'Passing the Baton, A Thanksgiving Reflection',
    excerpt: 'After 61 years of hosting, Suz hands the Thanksgiving baton to her daughter—honoring legacy, joy, and the evolution of family traditions.',
    date: '3/15/2027',
    dateSort: new Date('2027-03-15'),
    readTime: '9 min read',
    blogNumber: 46,
    seoDescription: 'Suz reflects on passing the Thanksgiving hosting legacy to her daughter, embracing change while keeping gratitude and warmth at the heart of the holiday.'
  }
];

export const getBlogPostById = (id: string) => blogPosts.find((post) => post.id === id);

export const getNextBlogPost = (blogNumber: number) =>
  blogPosts.find((post) => post.blogNumber === blogNumber + 1);

export const getSortedBlogPosts = () => [...blogPosts].sort((a, b) => a.blogNumber - b.blogNumber);
